{
	"$schema": "../../../schemas/plugin.schema.json",
	"name": "WP Icons for Flatsome",
	"summary": "Velg WP Icons (Lucide m.m.) i Flatsome UX Builder for Icon Box og Button.",
	"versionScheme": "semver",
	"status": "active",
	"repository": {
		"owner": "bli-synlig-plugins",
		"repo": "wp-icons-flatsome",
		"visibility": "public"
	},
	"tags": ["flatsome", "ux-builder"],
	"author": "benjamin",
	"maintainer": "Bli Synlig"
}
