{
	"$schema": "../../../schemas/plugin.schema.json",
	"name": "Blogg filter (ACF + Polylang)",
	"summary": "Flatsome-elementer for å filtrere innlegg med ACF-taksonomier, inkludert synkronisering via Polylang.",
	"versionScheme": "semver",
	"status": "active",
	"repository": {
		"owner": "bli-synlig-plugins",
		"repo": "Blogg-post-plugin-for-flatsome",
		"visibility": "public",
		"assetPattern": "{slug}-v{version}.zip"
	},
	"tags": ["blog", "polylang", "testify"],
	"author": "benjamin",
	"maintainer": "Bli Synlig"
}
